"honestly it’s what I was saying earlier with the guys like I’m living with you know you try to sleep in one day and they are in your room yelling at you calling you names and stuff, it’s kinda cool. it sucks but it’s kinda cool at the same time. cohesion too and then ya just like trying to keep the family proud and everything as well cause my dads’ side is very tight knit. um and involved with messages and everything and everybody knows everything.
","that's a good question so I wanna be the best at ...Unintelligible… weight lifting or running or swimming or something like that so thinking that waking up their a little bit earlier to warm up ten minutes before trying to do that . yes. ya both ya actually so one of my mentors he kinda told me about this one percent rule and I kinda really I didn’t really understand what it meant at first but I it took me a long time to figure it basically said make yourself one percent better every single day when your doing so if your pulling yourself and go back in time the day before what did you do today that you didn’t do yesterday so try to better yourself one percent everyday 
",uhhh I I would say just trying to better than the person I was yesterday I think I think umm I think lifes in constant quest to get better and if I pay every single day I need to make sure I do something that makes me better than the human I was yesterday,"um well something that definitely you now uh grad getting to a SEAL team and deploying is the ultimate goal you know BUD;s at first now it’s not only getting to a SEAL team but being able to contribute something in a positive way once you get to a SEAL team. ya it’s more than just getting there being an asset 
",just getting just getting better and seeing other guys who are better than me makes me kinda want to push myself to be the best that you can be ,I think my family for sure. uh and uh definitely like not letting these guys down I think being like being a part of a team like that’s been such a constant in my life since the fourth grade when I started sports. it’s just so the better you do the better everyone does and uh just being driven by that like I live with guys and one of them is going to workout after this and now I’m going so it’s just like trying to get better and just competitions. ya I think competition are like ya ya I think peer Ya positive peer pressure. which is stimulated by this kind of environment. ,"so there are like you know cliche answers that are still basically true um you know coming in here and being with these guys once I’m here is huge like it’s you can’t be unmotivated being around this caliber of person um you now not not including myself these guys are just incredible you know I am very very uh its very humbling to work with them um but I would say legitimately just like the uh patriotism and like there is a conflict of good and evil in the world 100% and I think the fact like if if you know you don’t do anything when you are perfectly able and are in a position um especially being in this position you’re gonna be directly tasked with taking care of some serious issues like mitigating the amount of damage that evil can do for this way of life. So the AMerican way of lifes very motivating too and some people don’t have to worry about anything and its great cause you want to preserve that as much as you can. Um. 100% because ya because I think human beings, well I can’t say that um ya I feel like, I I was pretty selfish for a long time and you know being around these guys really, theres no room for selfishness its awesome, um I feel like I’m enjoying a lot of the freedoms that the American way of life has to offer and it’s definitely time for me to sacrifice you know for like thats another part of motivating me thats you know even if you look down on yourself for anything its like hey man you’ve enjoyed a lot so you know you signed up for this so do what you signed up to do um and do it to the best of your ability and just thats just pretty motivating just to get the most that you can out of it and the most that you can into it because those two are like directly related the more you put into it the more you get out of it and its not like like you’re taking away from this community selfishly it’s like you are just benefiting as a you are becoming a better person by being evolved in this community its it’s just pretty motivating like that’s motivating but that’s like a round about rabbit hole answer.. Ok, cool.. I don’t know what cliche means. ok. right. right ahh patriotism.. ","Um, well one you’re here for a goal and I’ll do whatever it takes to accomplish a goal, and two its just, you know, I feel like, when, again, playing baseball learning how to fail, it’s just a part of it, part of the process","Yes. Yes. I had some friends, both in a previous class and my classes ahead of me two that were really encouraging and helped me... Sort of deal with the challenge of having to come back. A couple of guys who are in this class now, actually, who had already been rolled from 334, for injuries or whatever, that they had sustained during first phase. I knew I was going to be classing up with them. So it was good to have them around during the time that I was rolled. Yes, I'm a strong Christian, so I pray quite a bit. And also kind of a weird little saying, but, uh something that would just help me stay focused. As I would just say, this is what I'm doing right now. You know, no matter what was going on, if my mind started to wander and I started to wonder, like, hey, you know, it's pretty sweet if I weren't out here in the search zone right now. I would just repeat myself, ""this is what I'm doing right now"". It doesn't matter what I could be doing. This is what I am doing. Just help me calm, stay grounded in the present moment.","A lot of self talk.  Uh, no. It wasn't a really matras, I never even really about training. I would just kind of talk to myself. It took one mind off, whatever was really happening, and essentially forgot about everything that was going on. And like, I always thought about, like what I was, ""oh, my car's broken down."" What I to do to it this weekend, I thought through- like I said, I need to work on this part, work on that. So I was kinda, I always kinda mentally just, especially during the more challenging ""not this"" evolutions, took my mind out of it and put it someplace else. So it's like something that happens, ""Oh, wow yeah, training."" Yeah. and it depends. So like they were- in the evolution that required focus, by, for instance, in third phase, when were doing IADs, I'd say that it's definitely more of a,  focus mode, but if it was something like a two and a half mile swim that was like extremely long. I would just, start thinking about other things and just completely forget about the swimming portion so, that autopilot, I feel like that helped, had they talked about how difficult... 
","That's, I think just looking for the guy to the left and right of you. It's like, you knowl don't do it for yourself, do it for the guy next to you. So if you're gone, they're going to be carrying more weight because you're gone. So in order to continue on, you have to make sure the guy next to you is OK, because that's what really matters. Yes. Yes, I did. I mean, I was fortunate enough- the guys in my boat crew who were also of similar heights. You know, I think I was fortunate to have a group of solid guys who we became very close with. So that driving factor of, ""I care about these guys. I want them to succeed as much as I want to succeed."" So I think that really is what pushed me all the way through. I think it would be my mentors, people that I talked to when I told them, like, I'm going to do this, like you said, to do this dream go all the way. You're not going to come back until you fail so-. Ummm, no it was more so at the end of the day, it's like, hey, ""I made it through another day."" I can tell them that I'm continuing on. But in a moment, It was the guys that drived me. I said the simple mantra in my head, it was, kind of, you know, ""Brothers do it for them. And that was just in the same vein for the guys that I did not do it for them."" So I would tell myself that things are rough. It's a very broad thing, but, you know, it kind of encompasses the guys beside me as well as, you know, my family and friends back home. 



",I hated failing and I was embarrassed.,"Um, well I've always seen this as a philosophical quest.",,"And I didn't think, you know, OK, like, this really starts right now like I don't have to be here. And I mean, I think a lot, yes. I think a big component say, well, my buddy still here so.","Uh, Definitely could not call my wife and tell her I quit, so I just wasn't going to do that.",And my family umm my dad my mom umm i feel like umm growing up in this kinda environment umm I couldn’t come home if I wouldn’t umm succeed,,"Yea uh this was during hell week it really came out it was kinda like our class thing um sorry if I swear. Alright uh it was just I have this video from our hell week um one of the instructors took of us just crawling around in the water on like Thursday morning uh chanting “It doesn’t fucking matter” so it was like our thing was like it doesn’t matter what you do to us or like how much it sucks, I-I’m not going anywhere. Yea a little bit. ","I would say what I get from my girlfriend. Just that, you have a really strong relationship. Just being able to be like, OK, today was a bad day today sucked and if I can look forward to calling her and, you know, almost in a way like you're a baby a little bit.",I … I just knew there was no way in hell I was going to quit.,,,"Not really, no. [Chuckles]. So I just went in to everything. ","Um just wanting to pass um like I like I was capable of passing the 4 miles or it was just like like it was hard like it was uh definitely a put out for me to get across the finish line. Mhm. Mhm. Running was not fun. Um I don’t know uh maybe just like (unintelligible) um just like being able to imagine what’s on the other side of the 4 mile um realizing that like it is like it’s just a 4 mile and like my life will soon cease to be just 4 mile timed runs like it will be better. Um I’d say that’s it. Yes. Absolutely yea um I met some of the greatest dudes here um like best friends like all all of them feel the same way everyone hates 4 miles you know it’s not like I know it’s-it’s not just me having that idea um. I want to say no but like I’m I’m sure there’s something like uh….um actually yea there was uh there was this movie called Fury um it’s about, I think Brad Pitt’s in it, but they’re like tankers like back in the day I don’t remember which war. Um but they always said uh best job I ever had. So maybe that. Out loud yea to my buddies like it was kinda a funny thing cause obviously it sucked we were saying it’s the best job we ever had and it clearly was horrible","Uh...I think I had just like...didn't want to leave my friends. I had come so far. Like, I've invested just a lot of time into this whole this, this whole pipeline. And I think the more I get into it, the more, you know, obviously the more skin that I'm putting in. And so at this point, it's like I'm sort of all in and it just kind of snowballs. You don't...you know, it's just like, why would I quit now? You know? Why would I leave to leave and...leave my buddies? Yeah. Yeah, I thought about my family a lot. Um...you know, feeling the shame of, like, telling my dad or my mom that like hey I quit or I got rolled or something happened. Um...yeah, that, that definitely weighed on me a bit. Uh, nothing like that. I remember, though, for, like specifically the OC-8 test, I would go back to my room and like write down, try to like recollect and rethink like, OK, what did I do that day? What did I do wrong? What do I need to do right? And just sort of like I could see something on paper and go, OK, just try to do that next time and um think about that like during the evolution. And like before OC-8 I was, I was on the pool that just going through kind of like, OK, remember the key points that you wrote down last night? Try to do those. If you do those, you're going to be successful, so.




","Definitely supported by the team.Uhm, everybody’s gonna have their, their days. I wouldn’t say one that stands out to me too much, but just like I, I have a lot of memories and just like the guys keeping you like in your perspective and just realizing where you are and being lucky to have such great people around you. ","Um I’d say just the guys next to ya, or the guys next to me that was the biggest thing just seeing them, if they were having a bad time just it can’t be that bad obviously you want to help out your buddy you grow and you form really good connections with em so like you really wanna see your good friends make it through as well, you do whatever you can to get em through.","I'd say expectations from other people, and meeting them. Keeping their respect. ",I've already tried everything else. ,"My faith. I'd say it's probably the number one thing. I try to always make that the number one thing. I always try to use the gifts God gave me and pull them. A follow on to that is family and blood family. But also the family that I've made throughout my life. Whether it's high school and then the Academy, Sprint Football family. It's always who and what I represented. Not just myself. When things get tough that's usually what comes to my mind first. I think of like Jesus on the cross just to try to put the pain in perspective. ",Keeping money in my pocket. Fighting for this country.,Knowing that you have to do it to be who you want to be.,
