I’m an only child,"I had four siblings and five including myself. uhh. I am the second oldest, . I have an older sister, two younger brothers and a younger sister. No an older sister, older sister, two younger brothers and a younger sister and me sorry about that  . so it goes sister me bro bro uhh sister bro bro  . yep sorry . uh 32, 28, 26, 21, 18 . no all the same. yep ","uh two. um I’m my brothers the oldest, hes 30, I’m 29, I’m the middle and my little sisters 25.  ","I have five siblings.  five siblings. plus me. ya my oldest sister is 36. next is 32. sister 32. I’m 25, uh younger brothers 23, uh next sister is 21 next sister is 18, 19. no my two older sisters are step sisters. yes when I was growing up they lived with us until I was like ten years old. yes and then I lived with the rest of my. ","three younger siblings. yes. two two younger brothers and a younger sister. so myself brother brother sister. uhhh. 22, 20, and 18, so I’m oh I’m 24 and 22, 20, 18. ",I have one sister uh casey she's 11 months older than I am  ,"Okay, so, all of them are half sisters. But one of em is adopted is my full sister, so. So i’ve got. No. So I've got three older sisters. I am 23.. I don’t know how old the oldest one is, uhh, the second is like 34 (this phrase was long and drawn out, sounding unsure). and then Alayna is 27 (this phrase was long and drawn out, sounding unsure). I lived with Alayna, my uh. She is half but my, she’s my mom’s daughter straight up. But my dad legally adopted her as his own. So ya. Crazy stuff. Yes, yes. The 27 year old. I should have just said three older sisters shouldn’t I?. ","I have one older sister, she’s 28","I have four siblings. Yeah. Older brother is 24, then me, just turned 22. I have a younger brother who’s twenty. Then two sisters, they’re 18 and 14. Yes. Married. Probably pretty close to 26 years. I have a great relationship with my parents. With my siblings, yes. We all get along. ","I have one sister. Uh, younger, she's two years younger than me. Divorced. Six or seven years ago. About, I’d say I was a freshman or sophomore in high school. When they finally got divorced, It wasn't a surprise. We knew it was coming, wasn't easy at first, but, gotta get used to it. Decent. Decent now. Yeah, decent with both. Good. I try to stay in touch with as much as I can. ","I have one younger brother is three years younger. Both of my parents are married? So, yeah, they have good, good relationship. They've been together my whole life. It's good. I'll talk to them all the time still while I'm here. Growing up, would describe as the typical relationship dynamic you would expect between your parents and kids. But I've talked to them a lot. 
",A younger sister.,I have a twin sister.,I have two siblings. One brother and one sister. They are both older.,I have an older brother and a younger sister.,I have a younger sister and an older brother.,I have three. Umm I’m actually a twin. My sister is 15 right now. The middle one she’s uhh 18.,"I’ve got two siblings, two younger brothers, they’re twins, their names are Brock and Brady. Umm they’re 14 years old, 8th graders, umm yeah they’re awesome uhh looked up to me a lot growing up","I have two older sisters. I’m the youngest yes. My parents are divorced, young age I don’t really remember. Uh no uh they’re both single. Uh it’s been uh they came down um this past weekend to visit me which is nice. Yea yea definitely my sisters and I are really close
","I'm one of five. I have an older sister, I'm second. And then a younger brother, he's the middle guy he's kind of weird. And then one sister and the littlest is a brother,.",My brother was born first in 1995 I was born in 1997 and my sister was born in 2000.,I have uh two sisters uh one is just turned 18 a senior in high school and the other is 10 years old.,"I’m the oldest and then I have a 25 soon to be 26 year old sister, a 16 year old brother, and an 8 year old brother.","I'm an only child. They separated when I was like four. Yeah, they're divorced. I'm very close with both of them. They have like a good- even after the divorce- they stayed like friends, so it wasn't like a nasty divorce. Uh, like now? I still talk to 'em multiple times a week. Not quite everyday, but probably.","Sure. I have uh a sister and then a step sister and a stepbrother. The youngest. Um my step sister is the oldest I think she’s like 28 , my step brother is probably 26ish and my sister is like 26, 25 and I’m 22. Yes so mom, my mom and dad divorced when I was probably like 2 months old um and then my mom remarried when I was probably (unintelligible) 8 I’d say. And then she’s been with um him since. Pretty good um. I do yes I talk to him, we have a good relationship probably 2 or 3 times a week um my mom, I wish I talked to her 2 or 3 times a week but she calls me every single day. Um and then my step dad, I talk to him when my mom calls so we hav--we have a pretty good relationship ","Yeah. One sister, she is about eighteen months younger than me….Mother, father. Married. Yeah married whole time. Um….let's see like it's got to be going on 37, 38 now. Yeah, a long time. Awesome. Yeah. Awesome role models talk to them almost every day. Yes.",I have one older brother.Married.I have a great relationship with my parents and brother.,"I have 3 siblings. I am third in birth order. He’s uh I wanna say 37. Brother was 5 years older than me. Middle, second brother was 34 so he’s 2 years older. Oh no actually my youngest uh I’m 30 uh he’s the 4th, so I have uh 3 brothers, not including myself. He was 6 years younger than me. ",I have three siblings. One of four. I'm a twin. So my sister and I are in the middle. One older sister and one younger brother.,I have seven sibilings. I am the middle child. Three younger sisters. I guess I'd be number four. He's uh thirty nine. I guess he's eleven years older. He's thirty six. The next one's one year older. Sister. One year older. She is twenty nine. I'm twenty eight. My little brother is twenty four. And his three sisters are twenty four. The bottom three are all sisters. Twenty two and twenty. ,"I have one younger brother, three and a half years younger. ",I have one half brother who is older by maybe two years. ,"I have an older sister who is twenty seven and a younger brother who is twenty three, twenty four. Older sister is three years older than me. My brother is one and a half years younger than me. That makes me middle child, twenty four. ","I have four siblings. Two years apart, overall two years apart. I'm right in the middle. I've got two older siblings and two younger siblings. My sister is twenty six. Three years older. Number two is twenty four. One and a half years older. We all have about two years apart. Number four is my sister. She is two year younger. I have a brother as well. He's the youngest. He's nineteen. Close to three and a half years younger, I'd say. I am twenty three years old. "
"umm so I uh went to the academy. umm so I guess graduating there. and like that whole switch thing they talked about whatever was I don’t know was kinda real and that was it for me.  I think so just cause you get to know the guys around here and when I was a tad for a year at annapolis too and I lived with four other guys who are in this class too just going through together was pretty cool. umm  I think so I don’t like being uhh bottom of the barrel kinda thing umm. and ya I get like a closet competitor uh. I’m not out there like screaming at everybody just a mild brain I don’t like to salute and stuff. umm I don’t, really I like following things through too that factors as well. ","I always grew up playing sports, I was a wrestler. umm training for that always just trying to be best of the best always no matter what. I did I went to a small school in new York called Suny Brockport uh I wrestled there and graduated with a BS . uh I had to put a lot of time into studying I don’t pick up things as fast as other people you . umm probably work hard I think umm put a lot of time in to train for buds. umm I uh originally was in class 306 and ended up DORing from hell week so I came back six years in the fleet came back here and went all the way through with 338. 306. yep . Uh I was an IT so I worked with radios . yes . thank you . um I would say I don't know the word a hard work ethic um I was more of an extrovert than most people . um I I always try to go out of my way to help people when they needed it and they would always try to help me if I needed it . it was kinda like I don’t know I always go out and try my hardest with pretty much everything I did",um besides BUDS. um ya I think BUDS BUDS is by far the biggest one. I have to imagine that will uh be everyone's answer on that question. before that. oh that’s a good question. ya i mean college I’m thinking if anything stood out as particularly difficult um overall kinda patterns carried out I wouldn’t say there was any sort of. hardship growing up that I had to do um I did get my pilot’s license um that was pretty difficult .  so that was probably one of them but there was no growing up family hardship. uh probably the same lessons you get um when you go to college or getting your license it’s applicable to BUDS um you learn attention to detail um you know you learn to both those both college and pilots license are just not something you achieve overnight so it is probably you get out of surveys you are working for a goal for a long period of time and you can't really give up halfway through that goal similar to BUDS so you kinda make the decision to do something and you follow through it um so you know you probably learned a little bit of that um I learned a little bit of that um just gently from written type stuff from having to achieve those long term goals not just an overnight an overnight success .  I don't think my personality changed I think I was the same guy personality wise now. sure sure well I think a big is just my Im pretty light hearted like I I was laughing for 95% of BUDS even when it sucked and that's kinda the same way I've been in life but like keeping a sense of humor with everything your going through everyones in the same situation. We’re all miserable together so theres something funny about that umm I think ve always be just not I it wouldn't sit right with me if I quit um everything I've done I did in life I’ve just whether it’s my own I don’t want to use the word ego cause that's a negative connotation but for myself you know I wanted to make sure I got through this and did it umm did never give up. I would say pride. ya I more pride less less ego I would. cause ego is a bad connotation around here but umm but ya my own self pride and self sense of accomplishment.  ,"lets see so I moved uh when I was ten we moved to Reno southern california and then uh I’d say the biggest one was when I was fifteen it was about 2008 I believe both my parents lost their jobs and we had to move in with uh relatives back down in southern california. so that was probably the craziest thing that happened. ya I was pretty I was pretty fortunate until about then i was about 13 years old or 14 15, I was pretty privileged until I was fifteen years old. well I learned a lot from my parents my parents kinda found work multiple jobs kinda found different ways for us to kinda be able to do the things that our friends were doing like playing baseball going on trips and stuff like that so they kinda sacrificed a lot so we could a have the things that we wanted. and then uh it was for my siblings it was a little harder them to see but for me i kinda saw what they were doing behind the scenes, stuff like that um, so ya I’d definitely say a little I got most of kinda that everything that you do is bigger than you I got that from my parents. and they never made an excuse they never complained they kinda just uhh they kinda just worked and worked multiple jobs and didn’t sleep and didn’t eat just for us and that was really inspiring and that kinda continued kinda still like today kinda the same way bt.  I guess I’m more kind of a quiet and I kinda just want to I’m also competitive and definitely through buds it's kinda it’s kinda the thing where uh you are always you don’t you wanna do better than the guy next to you like especially with a lot of like the guys here like some of the guys i’ve gone straight through with it’s kinda like that you know I’m not gonna let you make if I’m not gonna make it we started kinda attitude and you kinda started developing that in boot camp, the same guys I hung out with in boot camp are the same guys I hang out with now and it’s funny how that worked out.   cause theres a bunch of little clicks when you first get there and you kinda see um  you know those same people and clicks and I don’t know how that. oh ya. ya loyalty it’s definitely a loyalty for me. ","uhhh. not like really like comes to mind I guess, I don’t know um. the uh Naval Academy so. yes. yea probably, just like adjusting to it and I think ya so that probably shaped me I guess. to here. Uh ya I think it like prepared me so I was on the hockey team, I think that team aspect kind of like. helped. I think so as BUD/S went on umm. yes ya I think so the like put in the like leadership position kind of was not the first time but like sort of um kind of like beginning to take more people that I I um I don’t know. sorry. ",umm I did a kairos retreat in highschool.  um it’s like I’m not like super religious but that was kinda like a cool experience. turned to like strengthening relationships with family. my dad especially um and then honestly I think uh. No he wasn’t but it was kinda like a a like we wrote letters and stuff. like him and I always sort of had a strange relationship but that kinda brought us together a little but. and then uh going to Navy I think for me uh I needed discipline in my life at the time and uh I think it was uh really good for me and then getting into trouble at the Naval Academy like a lot uh it was uh kinda took me from not not not so good pat and turned me around. kinda forced me to look myself in the mirror and uh change a lot of things. yes. um I mean I think I took the value of relationships early on and uh. also like I was very familiar what it felt like to fail. so and I think that’s what messes with guys a lot out here you got these all american guys who come out here and theyve never failed before and uh you got someone whose royally messed up and uh they know what it’s like and then I think it helps from a leadership perspective you know give guys second chances and then knowing which guys are worth working with and so I think those kids.  um. um I was trying to recall things but no no I don't remember as much as I should. oh well oh ya I think um i’m a pretty light hearted guy. and having a sense of humor is a huge thing for buds like.  if your able to laugh about your current situation. then it makes it so much better. um so I think that’s huge cause I always found myself doing that and you know when your running to hit the surf and that’s the last thing you want to do it’ll be like what the hells going on right now. something like that something I thought that was something I enjoyed so ya. ya I think extroversion was huge to I think uh like as an officer like that was good cause like being extroverted like your not always gonna be uh you can’t really be introverted and I don’t think and have it work like to a certain extent you can but uh. going in and having that extroversion like uh reaching out and uh being able to talk to guys was huge and then uh I found like uh guys who were drawn like to  certain people like who responded well to that. I mean most most of these guys are extroverted. but there;s maybe like five guys that i would consider introverts out of our class of like sixty so uh. extroverts are all attracted to each other.  ,"Uh, I’d say like being baptized. For sure. um, I was pretty young, probably 14. No, this is christain, nondenominational. baptism. um. No, I decided one day. ya. (unsure on subject, hard to make out). Crucible or life shaping experience. Well BUD/s is pretty cool. ok. I did. Ya I’d say that that helped. Shaped, shape me a little bit, yes. It was difficult at first, it kinda you know gives you, helps you figure out time management, stuff like that. so that, would that help shape a lot of things.. I’d say, so the first semester I show up to college I had no idea whats going on, I’m like oh this is not for me, this is just. chaotic, and then it got, then you’d figure it out, you’d figure out a schedule and then you’re fine and then the next semester its like oh hey I’m freakin out again cause I don’t know all the time management stuff. but the second time you know you’re gonna figure it out cause you already did it once so and then every semester from then on is just easier and easier and easier. so, I don’t know, you have a word for it but I don’t think I do.. ya you start to build confidence. and your abilities to deal with things. So um ya, that that directly translates over into BUD/s because you show up to BUD/s and you’re just bombarded. but you know that you’ll fiii, iii its like being at BUD/s is gonna stay hard but it will get easier cause you’ll understand you’ll ya know what I mean?. ya I mean you your either going to or your not and. going through those experiences. now you know that what I’m capable so its kinda just a choice.... umm, (short pause) well I have, I I. I I have a pretty good sense of humor. and that is, that was. I mean I I I have most of the time just ya know kind of keeping myself entertained. sooo I don’t know, they they hate it but. its its how I deal with things. um (short pause) um like pretty. right. ok. Usually they can’t anticipate what I’m gonna do but I mean I’m fairly confident. um so that’s huge. and if you you believe in yourself but I’m also not like cocky because I had no idea, you know this is like a 50 50 in a way. for for me its its like oh we’ll see, hopefully I make it, you know so. I don’t how to put in any other traits (What I think he said, words hard to understand). extroversion. ya I’d say so. ya. yes. I guess I do sometimes. ","It absolutely had…I had…I felt like I had the mental, baseballs all mental, its physical but mostly a game of nowadays what kind of mentality you have. And I feel like…you know…you have three, if you hit three (intelligible) you’re a hall of famer, so failure is part of the game. So I feel like that helped me…constantly…constantly learning how to fail, and accepting failure, and always trying to succeed and learning how to succeed as well shaped me well to come to BUDS. Very, very high energetic. Um sometimes emotional roller coaster but for the most part very positive um love. I have too much energy. Um for staying positive like always finding humor. In uh the worst situations possible in Hell Week, getting gassed on the island in third phase just always, you know, having that high energy to motivate the guys around me","My dad was homeschooled all the way up until sophomore year of high school, and I went to high school for three years, graduated and I went to college for two years. I knew when I was in high school that I wanted to come to this. But my cross country coach at the time, I was very close with and who was kind of like a mentor to me. I wanted to kind of find out more about this training and about the demographic of guys who do well. So he contacted one of the NSW Scouts and found out that typically the guys who succeed are like in their young 20s. High schoolers don't normally do so hot. So. So he suggested to me, you know, maybe hold off, don't enlist right out of high school, maybe get a couple of years of life experience or not. Get a little stronger, a little more mentally, more resilient. So I took that advice on board and did a couple of years of community college just to stay busy. And then over those summers, I would go and kind of do something out of my comfort zone. So one summer, I went and worked at the summer camp in Yosemite. So going into that, I didn't know anyone there, had never been to that part of California before, but thought it would be a fun experience. And I thought it kind of pushed me to be better at adapting to new environments. I think it was effective. I think, I think, I changed a bit, most people do those couple years after high school. And I think that I think that I did better as a result. I don't know for sure what would've happened if I want to come here as 19 year old, but I'm glad that I made that-. Yeah. Yeah. And then just learning independence and making my own decisions, being away from home. Personality meaning…?. Right. I think I'm definitely introverted. So... You know, sometimes it's a bit of a grind being around all these dudes, especially, you know, things like on the island were together all the time. There's no getting away from them. But but I tend to also be pretty agreeable. I don't get angry very easily. And maybe as a result of growing up with so many siblings, pretty patient. Yes. And you can kind of take things in stride. So I don't think I really have any enemies in the class… I haven't gone off on too many people-. Right. I like to be calm and get along with others as much as possible.","Uh, not really. I mean, we tried to try to join the Navy when I was 18 to come here, and my eyesight was too poor, so I moved out of the house. It seemed like the right time. Stars aligned at that point. So when I was 18 and kept pursuing this goal, after I got LASIK eye surgery. I got the surgery immediately after I was disqualified for the program. And then I moved to Texas two months after that. And after that it took about two years to get contracted out. I worked with a friend who moved down there, started his own company. So he started going door to door sales with him. Moved to corporate security after that.  Life changing? Not particularly.  Oh, yes. I went to college for about a year and a half. And, uh, just I knew I was going to come here. My mom encouraged college because she wanted me to get my degree before I- if I ended up doing this why not make it college prior to this? I couldn't study, I was just burnt out from it. I wasn't having a good time or it didn't some fun and exciting. And I didn't really have a major that I just committed to. So I just decided I'm just going to enlist now... do that later. ...Uh, not one of the higher physical performances in the class, but boys, uh... Find out. Always had a personality that I feel like is just trying to help out. Trying to kind of help the team. I always had a teammate attitude. So I think that helps as well as just being a decent person to everyone, regardless of who they are, how they treat you. So I feel like that has developed me through that's definitely helped develop me through this pipeline and essentially just kind of building that team work. When I was in high school, I had a lot of friends that joined the Marine Corps. I wasn't quite sure what I wanted to do with my life, yet. The military was always kind of in the back of my head. And when they all started going to the Marine Corps, I uh, that was initially the plan. I was- Marines were always like the superhero. Like, ""Those guys were the toughest dudes and studs. Started working out with them. Uh, did some of their PTs with their leaders and stuff. I started, uh, training in my own time getting into shape. But that's kind of a phyical low, but I got into shape and I started becoming one of the fastest runners. They didn't feel like I was being challenged. So I wanted to try something more wishful- Marine recon. And uh, I was pursuing that for a while. And our friend in my hometown said, ""Oh, I'm saying for the SEALs"". I mean there was this old retired SEAL guy that trains, and ""you should meet him."" And I met him, and this kind of attitude and outlook on life, and how humble he was made me switch. The job isn't that much different, but I really like the way this guy acts, I want to be that guy. Yes. He was actually from the start of the company down in Texas. I moved down there and kind of always... Focused... like he was my boss, but he also had that unique understanding of what he would focus on this. 


","I'm proud of BUD/S yes, so I was in college and pursuing my degree earned myself a night in jail on a DUI. So that was kind of a big turning point in my life. I would say the biggest thing that happened to me, because that's when I really turned my sights from school to focusing on this actually into being suspended for a semester of college my third year because of that. And then from there, I decided to continue my education and go on to start training for this assessment. I left I didn't earn my degree. And I didn't did not finish. Yes. So I left and started training for this. And a year later, I joined the military. So I think that just knowing that I can overcome hardships are when things were- things was a pretty dark time for me at that time, as well as really disappointing myself and continue to go on. I think that knowing that I can could overcome, you know, like change events such as that going into BUD/S. I knew that whatever they'd throw at me that I can overcome it. I consider myself a pretty amicable person. I can kind of talk with people, connect with people. So that's I think the big thing here with the emphasis on teamwork is, you know, creating good, strong relationships with people around you. So I think that was a big part of it, was being able to kind of integrate with the class full of type A, very hardheaded people. So it worked out really well and it worked. I think I became pretty clear about everyone in class. Yeah I believe so. I think that I can convey my thoughts and emotions to people in a direct manner, but one that, you know, people can respond to. Yes. Absolutely. I grew up playing sports all my life. I've played three sports all through high school and have always had that competitive drive and desire to succeed. Well, absolutely. I mean, I think competition is- there's a difference between healthy competition and one where you want to be... raise your personal station and be detrimental to others. But I think competitiveness and good drive will to succeed is very important. However, having that competitiveness, you also want the people around you to succeed with you. I think that's kind of the essence of teamwork and something that's very important here. 
","I was considered successful. I won national championships and state championships I think that to me was life changing and I was on some great teams as well. I played football and lacrosse in college. Um, I think I was able to draw a lot from a lot of drills from lacross in college and in football in college. And uh, previous experience or draw from like if I made some mistakes, I could just think back to lacrosse ok this is what we did in this situation. This is how it should be. I think it could be very helpful. Sure. Like something that we used to say in lacrosse was like one more. So that can stem from anything from being one more rep in the weight to one more rep in practice to just focus on the next game and I used that in Hell Week all the time to be like hey I'm just going to do one more push up or. Yeah. I think uh I can take a lot. And uh adapt and will to change and my ego is not too big going to get in the way of anyone. I think that was really helpful. And I think ultimately I got to be able to laugh in the face of adversity or pain and just use humor all the time. I'm an outgoing, caring person. And a leader. And you can kind of you don't think about selfishly about yourself but you can also think of others. And I think you can just take a little bit more.","I'm pretty normal. Uh, philosophy and political science. Um, I love to learn. Um just, being inquisitive, and figure out a purpose mindwise in relation to helping others, and um, yeah those two things together I think make it, um, an easier experience.","No, no nothing too crazy. Um, I don't really know. It, um, if you asked anybody here, they would say I'm pretty quiet. Um, Don't talk a whole lot. I think, um. I think it’s. I've always been pretty like, kind of like an introvert. But, um, I’d say it's. Since I’ve gotten here, I've gotten a little bit more, quieter.","I don't, I don't I don't think so. Uh, Yeah. I mean, I mean, I grew up playing sports. Uh I think I know that this is what I want to do and I prepared for it very well. I was very well prepared. Uh yes, so I'm very I think the various eyes I have a really good sense of humor um...I have a very close knit group of friends and we've also made it all the way through with me. So I think that helps a lot...About uh preparation and training and all that stuff so I think that probably carried over well.","No, not really. Pretty normal. I don’t know. Um, so for me personally, I don't really take things too seriously. I think, just, having fun, helped me get through this. Um, I mean, I know some people are pretty, pretty serious when it comes to doing this. But I just couldn't be serious about it. Had to have fun. Joke around.","Umm definitely really umm persistent I’d say. Umm in high school umm I got like a 4.23 GPA being like a high umm doing like tough stuff if that makes sense uhh. Like uhh I’m also really timid uhh I like really quiet, uhh I like I love the saying “being a quiet professional” like uhh not talking to anyone umm like knowing what I’m doing and doing something really meaningful and big.","Life changing events? For me there was nothing like crazy, nothing crazy I was just when I was in college I was doing fine umm but I was just kinda bored with what I was doing, you know? It just wasn’t really for me, obviously I had finished my degree, you know my parents had saved all that money so I didn’t want to waste all that and not get my degree but ever since I stopped playing sports I just didn’t have anything to kind of go after and chase, nothing that excited me. Schoolwise I just didn’t see myself getting a normal job after college umm I’ve always liked things that are challenging and adventurous so that’s kinda why I came here but as far as life changing events there wasn’t any single event that was big for me. Umm, personality I’ve always been a pretty outgoing guy, always had a lot of friends growing up, like I said I loved to play sports, pretty adventurous, like studied abroad in college in the Czech Republic so yeah I would just say I’m a very curious guy, I like to learn new things, very goal driven, goal oriented, I like to have something to go after. Umm pretty motivated person, umm what else, yeah I mean my family and friends are very important to me, what else, yeah that’s about it.","Um just in in general or?. A little bit of college. Um . Yea uh I had I had a friend of mine die um during a swim practice um drowned uh that I don’t know that that messed me up for like a few days um but I had like a lot of close friends and family kinda reach out um . Yea yup um . Uh and I think that kinda just um after that I became a EMT um I kinda just I never wanted to be like in a position where I didn’t really know what to do. So yea kinda just sought out every means of um I guess just being able to have the skillset to help in any situation . Yes. I just feel for the family more than anything. Like kinda just like looking out for the other guys um makes things easier um just when you’re kinda not focused on yourself, you don’t really think about like how much pain you’re in um I think that’s something that will be (unintelligible) cause me and my friend uh pulled him out of the pool and uh like after that I spent a lot of time um like checking in on my friends like checking in on the family uh and all that and it kinda looking uh looking at like other people’s pain and like trying to help with that it takes away from your pain you’re feeling so that helped a lot. I don’t know I guess I’m not like I’m not crazy outgoing um but I’m not crazy introverted uh...I’m not really sure. I-I’d like to think so um I don’t know, I just had a good sense of humor about the stuff we’re going through here and I try not to take all of it too seriously. Um I think that helped.","I would say I mean, since I've had to move around a lot, I mean, I've gotten pretty good at making friends really easily. Cause I leave them and then I make new ones. But I'm pretty social for the most part. But I'm really quiet sometimes. I get some pretty energetic in the mornings, a lot of guys get annoyed by that. A little bit. I mean, I was definitely like not a troublemaker. Definitely not a troublemaker. I just kinda like kinda do my own thing. Like free spirit.","Not really I lived a fairly normal life in the suburbs, went to public school and then went to college. Uh my family always … sports … we were always pushed if you’re going to do something do it right. My dad was an engineer went to MIT, my older brother does very very good in school and is an investment banker now. We were always told to go for absolutely everything if we were going to do something. That was big in our house, out in the backyard we were very very active as kids and the way my dad pushed us we did very well in school but I just wanted to take a different path and be a part of something greater. Um I don’t know I really like being active I like being on my feet and doing something physically challenging that’s what gives me the most satisfaction and doing it and like being a part of something greater, doing it as part of a team and … doing drills or whatnot and doing them right. It’s really cool to be a part of a community that is constantly trying to make you better. … I don’t know there’s not anything to complain … especially when you get to this point now (unintelligible).","Uh senior year football, I got a hernia the first game of the season and had to get surgery the next day and couldn’t play football the rest of the senior year season. Very traumatic for me I thought I had worked all high school and senior year was kinda over right there. Uh ya so I kinda correlated it a lot its just another one thing that happened its like might as well push on with it. Uh I will definitely say a lot of these guys who are older and out of college are a lot more mature than me and they have taught me a lot. Um and I talk a lot jump around a lot but they would help me move down to uh more their level … I’m just like young, smart, a lot of energy. I would say I’m more lighthearted I take some things seriously you know. I think that does help because there has to be someone in the class who keeps the morale up and then there has to be someone who gets them where they need to go.","Um definitely my dad passing away. Kind of but not really … so he ended up being diagnosed with cancer, fought it, won it. Healed and then took a huge blow and it just went downhill fast. So I actually was in college, quite college and came back to try to help out with that and then after went back to college. Uh I just … anytime that it got hard you just think back on those moments because that was the hardest thing I’ve ever gone through. Because you think about your dad he’s your mentor … your huge dad he’s like 6’1” 240 lbs just solid muscle, worked construction. Have him every weekend and every week during the summer. That man who can lift cinder blocks for days and then he can’t even get out of the tub. Just helping him drive places and helping him get in and out of bed that just took more of a toll than anything so anytime it got tough out here just thinking that if I was in pain how was he doing what he went through. I mean the hard working aspect … I think the stubborness is number one honestly that whole factor of when people tell you to quit or don’t think you can do something the stubborn factor just outweighs everything because now I definitely will just because you don’t think I can. … Uh definitely humor you know I would say that’s a huge part of it … having a good laugh whenever shit hits the fan because they try to get you down all the time so just whenever you would find a way or find people to make one thing funny to aleviate that stress or pain that’s happening so yeah I think that’s huge that stubborness or finding humor in things.","Ummm, not really. I did. Yeah, I went to college for two years. I guess that's kind of it was kind of this. I just was in college and I was wanting to come to this and kind of told them I was leaving college so I had to finish, which I kind of like, knew what I wanted to do. And I was pretty, you know, like I was pretty set on it. So they weren't they were happy with my decision. Obviously, my dad definitely took it well. My mom at first was like, ""you're not gonna finish college?"", but she was good with it. And then I just left college and came here. Yeah, I enjoyed college. It was just kind of like I was kind of looking to see what I wanted to do. And nothing really stuck out to me besides this. And I'd like- so something I like thought about growing up, but it was never like, I'm going to go do that until I got to college and kind of started switching majors a few times. And I was like, ""you know what, honestly, I want to do this."" I don't want to be in college. Yeah.","Mmm no not really um pretty normal life, nothing crazy happened
Ok um can you give me an overview of high school, college
Um yea um so grew up in North Carolina just stayed there my entire life, born and raised in the Outer Banks um went to elementary school, middle school uh was kind of trouble kid I guess um 
You were a trouble kid? I was 
Ok
Uh teachers called my mom alot uh played baseball um 
What did you get in trouble for?
Just like uh like talking in class or like just like horse playing really just like messing around with my friends when I shouldn’t have been messing around with my friends um 
Were you in like juvenile detention?
No no no no nothing like that nothing like that just uh like phone calls home Hunter was talking in class alot, asked him to stop, he wouldn’t stop like stuff like that
Testing boundaries
Exactly 
Yea 
Um and then in high school uh just skateboarded alot and then um played baseball till like my junior year and then quit playing um went to college and then stopped going to college after like 2 years and came here
","Prior to BUD/S….um...aside from just having kind of like the one off relative pass away, which was a grandparent, no, I haven't had anything that, that has been kind of life changing. I would say. Oh, yeah, it was hard. Yeah, I grew up with them, um... Grandfather, yeah...uh but no, nothing really was that life changing. Natural causes yeah. Yeah exactly yup Um....as far as the life events, no, I don't think so. Yep. I went to high school and then played football in college,um...played local here. I would say that was probably more just kind of being a lifelong athlete was more, I think, kind of the hinge point for, for coming to BUD/S and, and doing well here. At the University of San Diego. It would be D1AA.. Defensive end. Um… As far as character traits and… Um...I would say I'm probably a little more introverted. As far as like being outspoken and being kind of like a leader. I’m sort of just like hitting the follow button for BUD/S and...and being coachable.  Just kinda...do what I’m told...you know pass test gates. Um...yeah. Really not trying to do anything like really out of line or anything like that. Sort of...follow the natural progression. Phase to phase.  I think so. Yeah. Yeah, I think yeah I think, I think my friends would say so too. Definitely not the jokester. But, but the sense of humor is huge here. Yeah. You definitely need that.","Uhm, I don’t know.  I wouldn’t say I had any like major events that were super life changing it was more of uh just kind of a gradual shift in who I developed to be. Uh, I think, helped me just like more of a serious guy, uhm kept things professional when I need to, but I was just kinda able to keep some perspective and laugh about things at times. It kinda worked as a balance for me. ","My parents are really strict, and just the people I met growing up. One of them was uh one of my mentors was a retired senior chief and the stories he told me about the teams and everything else he’s done definitely attracted me to the teams. No actually I just met him by coincidence, and then talked from there and then talking to him I read pretty much every book I could find about the teams and went from there. I’d say just the biggest thing is probably just not quitting all this just finish whatever I start, I’d say that’s the biggest thing that just kept me going and then always with the attitude of uh expecting the worst case scenario and then not really caring too much about it. ","I went to a very small all boys school. I graduated with 57 boys. So it was a very BUD/S environment where you were just with the same people. And that sort of community was very important to me, espeically playing sports within that community, which is a smaller subset. So I felt I needed to find that same community, which is a smaller subset. So in college, I really focused on coming to BUD/S. And making this my career. I went to Yale. I think most people would tell you I'm a very quiet person. I've never been comfortable like in the spotlight, but I think that's helped me where I'm used to being in my own head to some degree. Like, uh that part of BUD/S like the self-taught aspect was never really a problem. That never really needed to find out with other people to express their frustration or stress or anything else. ","My dad died when I was nine, and my older brother's dad died when they were six and three. Then my little sister's dead Mom when they were younger too. My older brothers' Dad died when they were six and three. So long before I was born. And my little sisters mom when they were younger too. I think it was when they were nine and then I guess nine, seven, and five. No they are step sisters, my little ones, my brothers. I only have two full siblings. Yeah, I'm the only one who was in the house with every single sibling. I guess most people would probably say when my Dad died. But I'd probably say when I was in high school I got in trouble, my sophomore year and my mom grounded me and locked me in my room when I got off school. So I'd get off school and lock was on the outside of the door. She'd put trays of food like I was a prisoner. And I wasn't allowed to talk to anyone in the family and I wasn't allowed to play sports or workout. This lasted for a month. She took the TV, so I started listening to the radio and she took the radio out of the room too. She took all the books out, so I just did my homework and would stare at the wall until I fell asleep. I egged two cars. You decide what matters. I don't know, I mean, I gues people telling me I'm not going to do it. Pretty easy for me to focus. I knew I was going to make it, so I didn't really have a response. ","My Dad and his Dad both went to the Academy and played Football, so that's one hundred percent what led me to the Academy. And especially this was after I got cut from the football team my freshman year. I went to the Sprint Football team, that influence, is why I'm here. So I never, definitely, never seriously thought about this really until after getting to the Academy. When I was younger, in first and second grade, I was a little troublemaker and my Grandma, I just remember this talk, I did something stupid, and she kinda put me in my place. Getting cut, that was a goal I had set for myself from as old as I could even understand what my Dad and Grandpa did. That was a very long way lifetime goal. And I was just completely lost, I don't feel like I have the right words for it, but just completely lost. Felt like no purpose, so I had a couple guys that I played ball with at prep school that went straight to Sprint from there. Then I had a new purpose, and I started to look at why did I actually come here? This goal didn't happen. How might I respond? And then, the theme with that talk with my grandma and whatnot, the theme of like a restart, those two specific events, they happened, and then, a new me when I was younger, and then when I was older, over plebe year. 
I think I'm pretty disciplined. I talked about those couple goals. Goals set early on. Just discipline and working hard and figuring out what I need to do and then just continuing to do that. I think that's been the best. I read the Jocko book, discipline equals freedom. There's a lot of stuff that I connected to myself where motivation. There's a lot of times, obviously, for sure in this pipeline, where motivation was not there, but discipline to just keep with it. ","My mom, not my Dad, forced me to be my own man. My mom was a single mom working one job. My grandma also took care of me. Not relying on anybody to get it done.
Aggressive, straightforward, no bullshit. ","I actually think about this a lot. I though my preschool was really cool. It was at a young age I know the younger you are the more critical development is, and everything at my preschool was a place where I thought creatively and imagination is really rewarded and encouraged and I think that kind of really shaped a lot of what, how I approached, education and pursuits and whatnot, I give a lot of credit to that. Then sports were huge in my life, Pop warren football, I was in eighth grade. That was the first time I felt that coaches expected responsibility and maturity from us. And this idea of really navigating adversity. One of the things they did there was whenever I couldn't make it to practice my mom would call the coach and they said, ""hey, no more of that if you aren't going to be at practice call you call us yourself. I don't want to be hearing from your parents."" To me that was something that clicked, I was like alright, time to start taking responsibility for myself, accountability. I went to an all boys school, a private Catholic school that was big for me too. I ran track there. Kind of a lot was expected of you and I were given a lot of rope to hang yourself, but a lot was expected of you and I ran track. It was a good track school. I was given a chance to be really surrounded by guys who are willing to do the extra stuff, extra work to become champions, winners. That's kind of where I get my competitive nature and my willingness to win. And this kind of the idea of brotherhood. I really didn't become a good friend in general until I was a junior and I remember it clicking one day, I got to be a better friend. And as soon as that happened, being a much better friend to people. 
I think I was just driving one day or something and I'm like, you know what, I really was thinking like who my best friend was like, I got to be a better friend to him. It wasn't necessarily an event that happened, it was the realization. Like, I really want better friends in life  and want my friends to have my back, and I realized I got to be that guy in order to have those friends.
My high school was awesome. It really gave me this idea of a lot of things I experience in this pipeline. My experience in high school and on the track team just being surrounded by guys who, complaining was not, they just take whatever you have, just suffer on your plate and make the best of it and you don't make excuses. Track was as much more of a team sport in high school than I think it typically is just because you were just about winning two events. And then I went on to lifeguarding. Lifeguarding was huge too. Summer after my junior high school, I became a lifeguard and embracing the suck was big there. You're a rookie, you're treated pretty poorly. People warned me it's going to be the best job, but your first summer it's going to really suck, but it's going to be worth it. As a rookie, you did everything. I remember after my first day working just being exhausted after my first day. You did everything you're thrown into, drinking from a firehose. Same thing I experienced a lot in this pipeline. You're always uncomfortable, you get cold a lot. As a rookie I never put on sweats on because I knew I was going to be there first one to go on rescue. So I'd never sweats because I didn't want to take too long to go on the rescue. You get hazed a lot. My lifeguard stand had the three o'clock block from three to four, they would just mess with me for an hour. That was like an established thing every day. Again, it's a responsibility. I remember going to those workouts, like track workouts that's one thing, if you lose a workout, if you don't do your best, you're going to lose the race, and having this feeling, this weight, if I don't do my best on this lifeguard workout, it could lead to me losing a rescue, it could be me causing someone to die. So I felt a lot of magnitude there, I felt a lot of importance in what I was doing. Main takeaways was that idea of responsibility was even furthered beside of that job. That idea of embracing the suck and dealing with it rather than finding ways to deal with it internally rather than just trying to get out of the situation.
Gratitude. I think gratitude is the biggest one learning just to be grateful. I mean, whatever is going on, you're going through the worst evolution ever. You feel like you always have something to be grateful for, so if you're grateful for something it makes you feel better about being in whatever situation you're in and if you're gateful for something, you want to protect it. So I think gratitude is huge for me, and just doing BUD/S in San Diego you have a lot to be grateful for, and just owning whatever your mistakes are, not refusing to, it's like a nice, easy way to get out of it. It's like a dopamine rush getting out of something getting out of maybe not blaming yourself, I realize is much better, healthier to take responsibility of your mistakes. Empathy is big. I always want, I've been described to people as empathetic. And I think that is huge here because you got to be thinking about the people next to you. Gets you through it, doing something for someone else rather than for yourself is always, I think, I can motivate myself to do that more easily. 
And humor. Just being able to laugh in a situation, being able to laugh at yourself. That's actually one of my favorite qualities in other people being able to laugh at yourself. And I don't quite know why that works, but I see the guys I'm surrounded by and what's helped me get through is I think the ability to laugh at myself. All I know is it's the people I'm most drawn to in the community are that are able to laugh at themselves. 



",
