"so I hate the cold so that was bad for me. uh I think what was probably the worst was life saving for me uh I just had I like saving an instructor and I had to grab a big guy like and I kicked him in the groin accidentally and he was not not too comfortable with that um so usually you swim to the otherside of the pool and he meets you half-way and he chased me all the way across the pool and then some so I’m seeing stars by the end of that about to pass out uh whole life saving and just like everyday grind. it started to add up. um on a daily basis it was just like I can’t wait to go to my bed. and then I’d just keep saying in my head the faster you go the faster you’re done. kinda deal so I’d do that for runs um for swims and all those like like earned yourself a little break here and there and that just helped me a lot. um I would do I’m catholic so I’d like pray every night kinda deal. nothing insane, just before I go to bed. no I just like in my head kinda thing. um I would stretch um I would start getting like kina hip pain a little bit so I would have to stretch out my hip spend a little more time at night doing that. and then just hitting the verbal way harder whole friend group was just and like and then my roommate and I back in first and second phase um it was just communal complaining just lets you see a funny side of stuff kinda makes you less angry there’s that so essentially. definitely
","uhh I think the worst thing for me was chest carrying the log, log PT .I don’t know why um its I thought I had a pretty good foundation in strength but that crushed me everytime  .um its kinda looking over and seeing other guys suffer to and seeing someone who is 18 19 I’d say maybe 160 150 pounds and their right there suffering right next to me and try not to repeat six years ago you know what I mean .I did um the boat crew that I had was for the most part solid we had guys in and out but we always tried to win everything so you know being the fastest in the boat being the fasted on the logs so we didn’t have to do the extra PT sometimes we wouldn’t be the best wed always try our hardest but most of the time we did really well so that the uhh the crew that I had would rotate guys out fresh guys in all the time .uh so I do a lot of visualization that’s a big thing for me .sometimes it doesn;t work for people .Ya I learned that here .um I I don’t personally um I probably should honestly.uh for anything physical I try to do uh dynamic warmup.ya exactly ","Monday of hell week. about 24 hours into hell week I was having a pretty rough go I was tired cold and hungry I hadn’t quite got into that lizard brain state yet and one of my best buddies who Id spent the last four months with I knew his family his girlfriend he quit uhh  that kinda rocked me a little bit uhh but then I remember we did a very specific evolution called uhh base tour it's this savage like long run with boats on head and it was one of the hardest things of BUDS. That actually kinda kick started me into feeling I was down in the dumps and we did that evolution and I was like hell yea like this is exactly I deserve to be here I belong here and for the rest of hell week I knew I was gonna get through it, it was just that one one crazy evolution that got me through that. that pain and that suffering pushed me into that primal state.  and I was pumped about it. ya. I felt like it was a journey that we were all in together but at the same time it’s your own path, the hell week battle it's it’s a big internal battle with yourself as well. You obviously have to rely on the support of the guys around you but there has to be something inside of you that gets through it, you control your fate. I could've chosen anytime to quit or I could've chosen anytime to push through it. You gotta chose it. honestly I don’t do much of that stuff. we learned a bunch of mental toughness techniques uhh for hell week but I think umm ya I mean there was a visualization and I used a lot of that for more technical skill type stuff for example we had this stuff in phase two called OC8. it's a very technical test. I did a lot of visualization at home to get the procedures down right. But as far as Mental toughness you just kinda its hard to put a finger on it I just didn’t quit. yea its like chair flying you know the whole going to your happy place and stuff like that didn’t work for me Id go to my happy place and get hit by a wave. and get knocked out of it, it didn’t do much. ","I guess the most the most challenging thing is probably when uh I guess it was kinda lose focus and looking at the big picture instead of focusing on individual tasks that you were doing, like during hell week if it was Sunday night of hell week you were like Jesus I have five more days of this I don’t know if I can do that, that’s when you have to recognize that negative small talk and sort of look at the small picture for me i guess during hell week i can kinda remember um focusing on uh you know one step at a time rather than looking at the big picture and even when you finish hell week and think about everything else you have to do it’s still kinda overwhelming it's kinda just one step at a time getting through OC8, getting through your pistol qual, getting through your rifle qual.   so. ya. ya my buddy, I didn’t want him to get through and I didn’t get through I didn’t want to have to tell my family that I quit. um that was probably the main thing was embarrassing my family most of all and having to put my helmet on the grinder. and having my name out there. ya it’s competition. that’s kinda more of a the that's part of it definitely. ya definitely definitely. yes I do pray. um stretching not so much. so like ya I guess this was more of a second diving thing but visualization. definitely is huge probably the most important thing. ya um visualization. ",probably the first day of first phase or I’d say that um the the the uh first it’s like uh barracks inspections.  that was ya. uh just telling myself not to be like uh just the idea of having to call my parents after that and my brothers and stuff and just telling myself I wasn’t soft thats it. yes uh I well what would that be considered. uh. no like so. it’s more like don’t be like. ya be weak. um. yes and I think that uh what motivated me so being with the same group of guys that came out from the academy with here. like being with them every day helped a lot like seeing them go through the same stuff not wanting to let them down kinda thing. pretty much not wanting to let them down was probably the biggest motivation piece. other then just like getting. no other than just like preparing before and working out and stuff nothing specific on that one.  ,I hated the uh the uniform inspections the most cause I was like probably gonna fail and uh that was just like a shot to the heart cause you would spend so much time and you just ya I didn’t like those but all the physical stuff was particularly bad and like we went through like a summer class so it wasn’t like that cold so you gotta get to the guys who are going through first phase now it’s really cold. but no I thought uniform I hated that stuff cause you spent so much time. like the uniform inspections specifically. I think like the legacy like there's never been a navy lacrosse player to quit buds so I wasn't gonna be the first apparently uh there's more like asterisks but it's kinda like medical type thing um so like um so like as I was told before going in so like you don’t wanna be. that guy right then um one of my classmates uh told me this one thing uh it’s like you so when you quit you put your helmet on the grinder right so your your name is on the ground so. so your putting your name like down in the dirt. and I’m like I’m not gonna let that. I don’t want like your name to be associated with a quitter. ya which gets put on the grinder and everyone walks by they are like dang they are literally looking down at it right. it's like a symbolic thing for me and I’m not gonna let that happen. I’m not really religious but I pray ummm. I would like eat sing and get breakfast every morning. every morning I had a frosted mini wheats and watermelon. and watermelon and I had a good day one day like the first day so I was like this must be the reason why.. and so I like every day that we had breakfast in buds I had a and besides that i don't know I’m pretty ritualistic or superstitious oh like like uh I wore like I wore like the same shirt a lot or like uh someone had a good idea was like every not first phase in first phase I got fifteen shirts right because they were work days and I’d just throw white shirt out at the end of the day and I’d start each day with a. fresh white shirt.. just stuff like that i guess but like by uh like in second phase you have all the pool comp stuff so I’d wear the same brown shirt everyday till I like failed and then switch it and start a new one and then in third phase which sounds gross but I mean it is kinda gross and. but then in third phase I did that same thing too it’s like I’d pass one qual and I’d just keep wearing the same shirt till I passed the next one and then changed eventually but things were going good so if it ain’t broke don’t fix it right. ,"You know I always thought that I would think about that um so the CS gas on the island sucked, that was terrible. um that like that that’s just terrible. that was so terrible. so what’d you ya mean you’re in third phase on the island and you know you’re gonna take it, that’s just the way it is, it’s theres. no alternative. 100% I actually felt held down by a couple of my buddies like just cause you know you got your arms stuck together. that was that was rough um friday morning, err early friday morning at like four five a.m. of Hell week was like I was cold I was like I was. Friday. Early Friday like five o’clock in the morning, when the suns about to come up but it’s still not up, it’s just like you’ve been at it all week and I was just like there was I was just quitting wasn’t even on the table, it was just like just was you’re like I don’t know your body just, they told us to hit the surf and I was just so infuriated because we’re already so like whatever anyways you hit the surf and it’s freezing and I came up and I’m like, you ever seen the scene in like wolverine just like grrrrrr that’s how I was, I was just pissed like that sucked but it was also funny every everything is awesome hindsight, once it’s all done it’s all fun and funny and it’s great but I remember like looking at my buddy and i’m like on a boat and he’s on a boat and I’m looking at him and we’re sarcastically doing it but we’re like acting like cause it’s friday of hell week you know and nobodies gonna quit.. that sucked. ya I practice (unintelligible) uh visualization is huge. visualization if you like that helped me so much just just going through the event like whatever we were doing in my brain first and you know it also ensured that you actually knew what you were doing because if you are like visualizing something and then you’re like hey what’s this like you don’t know what it means so you can study up on it more and then come back visualize visualize and just do runs like that cause there was times on the island where we were doing runs with weapons and it’s like I don’t really know what the hell’s going on and then you visualize visualize visualize it and your still like oh I don’t know what’s happening and then their like go and then you just do exactly what you just visualized, it’s just crazy and per per as well for sure. whenever whenever it’s something cause you know those times where you feel overwhelmed 100% and it’s like hey man ah you know you put this on my heart to do this so whatever you want to happen, that’s cool you know whatever your will is that’s great and he’s he’s been super supportive the whole time..... I think he’s really been helping a lot.. ","Ah well I got rolled in um OC-5, uh, that was the first time, I have never felt anything and I swear on my lung nothing in BUDS compared to OC-5 and I failed it three times in a row. Three attempts then I got rolled OC-5 is um buddy um ditch and dawn your gear underwater. I had three little procedures messed up and that was the best thing that has ever happened to me before. Because I absolutely love this class it kinda humbled me a little bit I mean I was passing the former (intelligible) I got rolled and it was kinda getting to love these guys, I wouldn’t change it for the world. Um, well one you’re here for a goal and I’ll do whatever it takes to accomplish a goal, and two its just, you know, I feel like, when, again, playing baseball learning how to fail, it’s just a part of it, part of the process. If you haven’t noticed, theres probably like 20 of us, and this class had like 59 that are in 338 so having that part of group of friends come in and is just kinda you know 59 originals coming in is a small group so its very easy to mesh. Um, I feel like when we got gassed on the island that was a mental stay in it, stay in the fight, stay in the fight, other than that it was just you take something and you just do it. That was that was something I feel like that is all individual. I mean as a group, we got grouped, we got gassed as a group as a class, but as far as individual I feel like everybody had their own mental fight. It was the worst evolution in BUDS. It was simulated death.","All that stuff's challenging, certainly. But I think for me, so I was, uh, originally three, four, and then I got rolled in hell week, for a couple of injuries... and I think kind of making the decision to stay mentally in the game and come back with the class that I ended up coming back with three three seven. That was a very difficult decision because I'd been pretty much all the way through first phase, gone through, you know, a really challenging selection and realizing that I was going to have to start back. They won and no one cared about what I had already finished. That was really hard. Already having seen behind the curtain knowing that all that was coming. I think just the resolution I had already made that this is where I wanted to be and what I wanted to do. I was I was still willing to do whatever I had to do to make it. But it was not an easy thing to accept. Yes. Yes, myself and I told my family I was doing this. My reputation is really important. I didn't want to be telling my parents saying, you know, it's too hard.
","I don't know if I can really narrow it down to a specific evolution. All of it's difficult. It's getting cold. It's definitely a mental challenge. But if there were no rules, I think the most challenging part is to... Always, always keep your self-confidence up. Never let that nagging thought of am I doing good for it? ""Am I... am I doing well enough for the team?"" to not creep in, even if you're doing perfectly fine. That was something I always get in my head is ""am I hurting people?"" I never came to the conclusion that I was always, I was always thinking about that because I didn't want to hold anyone back, or be a liability. So that was always kind of a treat on my mind. Oh, the dedication to wanting to be here, I guess. I mean... Sure. I mean, I know I'm not one of the.... Division one athletes in the class, but uh... it really boils down to how much you want it, how committed you are to being here. Nothing else matters. If you wanted to do- well for most guys it's you want to do- how badly do you want your job, how badly do you want it? So it's really just boils down to your self-confidence and self... Your desire i guess to be part of and willing to serve this community. So I know it's not going to be- it's going to there's going to be harder times, that what were put through here, so there's never going to get easier. You kind of have to accept that its our job to get through this. And that's going to be way easier than the....
","I think it was overall just being doubtful of... my ability to do so. You know, you're surrounded by so many incredible athletes, incredible driven people. That was kind of a thought of... You know, if you see guys quit, you thought were absolute studs and like, okay, these guys can't make it. Will I be able to? So I think that just like on a day to day basis, like, hey, you're going to get up and you're gonna do this to the best you can and whatever happens, happens. But I think this mental aspect is is by far the most challenging part physically. Everyone can do it, but mentally is where it separates who does and who succeeds and fails.","I failed pool comp my first time. And it was challenging because I thought I was comfortable in the water. But I had to get into like another level of comfortability and for me that was just relaxing. I feel like in this program you're taught to really very upright, very hard, but and that instances like hey you just need to relax, like hey you're completely fine just calm down and that's hard for me to like just chill out. I used visualization. I hated failing and I was embarrassed. Yeah well, all they dudes are really helpful and encouraging. How can we help you? Sounds cool to see. Um yeah. One thing you can practice the diving on the grinder. They call it dirt diving. So I think anything too too challenging that we had to face certainly its organized chaos but I wouldn't say anything too too crazy.","Commitment at BUD/S? Oh. um, breaking my foot and having to do hell week knowing that I had a broken foot was, was a doozy. um, but sure better than repeating it all. So. I would say that was hard. Uh, family, I mean I've lived a pretty privileged life and I've had a lot of opportunities afforded to me. Just wanted to, be able to know that, give back and that it's not about me type of deal. And know that there's kids around the world who have absolutely nothing.and, Just pretty easy to stop thinking about yourself. This is gonna be tangential, but I guess I’m going down this rabbithole. um, yeah, and then obviously within the psyche of the individual, and overcoming all these different desires in order to better understand yourself, and I think that relation to knowing who you ought to be, uh, is important then removing yourself from the physical equation. And learning whether or not that is actually true, and this place is an excellent environment to learn just that. Um, I guess in a different note, for a different answer. I mean obviously I thought about that, but.","I’d say, um, just the, uh, relentlessness of it. Um, there was times in first phase when I’d, where we’d have an extremely hard day, and I’d be like, well there’s no way that it could be that hard the next day. It was. So. I’d say that was probably the biggest thing for me. Um, say just keeping a positive attitude. There was no, like, specific thing I would do. Anything like, anything I would say to myself in my head. I don’t know I just kind of did it. And, just kept going. Definitely in-, I'd say both. Internal and, um, being around everybody. Knowing that you're going through the same pain is, um, good. No, I didn't do a whole lot of stretching. I'm not very religious. Um, I mean, for me I was just always at, at the end of the day, just ordering a pizza from Dominos. That was my big thing, so. Um, I’d say, just thinking about my family. I couldn't...just letting them down was probably the one thing I thought about, um. Other than that, no.","Uh so on paper, the most challenging thing that I thought at BUDS is pistol qualification. I failed it twice. I then barely passed the third time. Um but I said the most difficult thing was Hell Week. Basic physiology. I still haven't found a world character. So a big motivator in BUDS is is uh a part for me at least is the fear of failure over want for success? Because if you get rolled, you can lose all your friends. Especially with pistol, you literally you literally go home eight or nine days before you finish. Which would suck. Um...so yeah, I'd say that's a big one. Losing your friends, I think was the worst thing and having to for me at least really go into the class, have to see, you know, it would be fun to meet a bunch of people, but like also you really, really bummed to see your friends go on. I think. Yeah, I think uh that might be one of the subconscious things. But I was like, I'm not...I don't understand what like I never like I was never going to quit. But it like it wasn't like that. You know, reality was I wasn't aware of that reality.","Um, probably being away from my wife. That was one of them. And um, Other than that, I mean, it’s hard, but I mean, I feel like I was able to handle it pretty well. Uh, yes, no, definitely. She, she definitely helped me out a lot. Um, say, I've known her for so long, she’s always been around, and um, just being away, you know, was kind of tough. I've only seen here a handful of times in the last year. Yeah, she definitely helped me a lot. Cause, you know. Uh, I would say a few different things, um, especially going into hell week. Uh, Definitely could not call my wife and tell her I quit, so I just wasn't going to do that. And then my, i would say my dad. There was no way I could, you know, let him down. Uh, not really. Um, but I would say almost all of it is mental. Um, anyone can, can train and get to where they need to be, physically, to pass all the, you know, evolutions and whatnot. But it really comes down to either you want to do this or you don't. That's really all it is. I think a lot of people seem to forget, you know, being a SEAL isn't, you know, boats and logs and hell week, its, um, not that forever, there's an end to all of it, and then, you know, you start doing stuff that you'll end up using in the job.","For me it was definitely the grind like umm going from like a high school setting where yeah I have to wake up early and study for a certain essay or test and coming here umm getting your butt kicked everyday and umm and then if someone would ask me the hardest thing for me It’d be like Hellweek. Hellweek was definitely really tough umm its like for me like normal days during first phase you wake up umm and like at the end of the day you get to be like yeah I get to take a warm shower and eat a lot of food and then Hellweek is just like I’m staying here until like I finish umm like Tuesday night you’re like umm you’re shivering umm like I can’t feel my feet anymore umm I’m chaffing umm I’m so tired I can’t really stand up and you’re just like oh my god I just gotta keep going like umm. Umm definitely like umm having just like grit like definitely frew up playing sports that need a lot of grit like wrestling umm requires a lot of heart. And my family umm my dad my mom umm i feel like umm growing up in this kinda environment umm I couldn’t come home if I wouldn’t umm succeed. Umm I felt like uhh I couldn’t see my famly again if I failed umm. Like uhh the guys uhh I definitely couldn’t have made it through without em like certain people here especially from coming from and being young during this experience and some of these guys umm are 10, 12 years older than me and having so much more experience they defi italy helped me out. I couldn’t umm have done uhh be where I’m at without. Umm I’m catholic uhh I prayed a lot umm uhh there were moments during Hellweek and even in the Island where I where I thought there was no way I imma fail something like a testgate or Hellweek I, I look up to God and prayed to Him, He uhh definitely feel like it helped me through a lot of hard times even like getting getting to Bootcamp or getting through that rough patch after high school to get here umm I definitely do have a lot of faith. That definitely helped me out.","Yeah, I wouldn’t say any single thing was terrible, for me it would just be like just the grind, just waking up on a Wednesday or whatever knowing that you’re going to have to go out and give 100% again that day and you’re super super tired um I would just say getting yourself out of bed in the morning … once you get the day going it wasn’t actually that bad … um but that was actually one of the good things about Hell Week. You didn’t deal with like having to wake up every day and being and like being in your warm comfortable bed you know um ... yeah I would say that was the one thing that was the hardest for me. Getting rolled sucked too. Umm just having to watch all of my good buddies go on with training and I have to sit back for seven weeks for one tread is what we failed, what we got rolled for. That was pretty tough at first but it ended up being one of the best things to happen to me. It was definitely a positive. Um well first of all I got lucky because the other eight guys who got rolled with me I am pretty good buddies with so being with them was huge um the guys in this class are awesome I love class 339 um … what else … just having that time to kinda grow and um it was right after Hell Week so it gave me some time to relax and rejuvenate myself metnally and physically and then you know take a step and see what I can work on and get better um you know and I figured if I have seven weeks off I’m not going to waste my time I’m going to try to come back a better BUD/S student. Um and in the long run it definitely, after I came back from that I had no issues, I hardly failed anything at all so I definitely think it was a positive thing. Nothing big really you know I tried to take care of my body during First Phase I could have stretched more, I would go get massages on the weekend sometimes … um as far as mentally I just tried I just tried to get as much sleep as I could. On the weekends a lot of times um a lot of times they would have guys in the barracks that you could pay that would shine your boots. I would always pay someone to shine my boots um … yeah I just tried to take care of my body get as much sleep as you can. You know you would see guys throughout the pipeline who were getting sick were hardly ever making it. They would get rolled or they would quit because they were always getting rolled. So that was a big thing for me I just wanted to keep my body healthy for as long as I could because you would see guys get rolled and the second time they would go through they just don’t have it in them anymore.","Uh. For me it was logs, I hated logs. Um. They just they just sucked. Um yea lot of lot of pain. Yup. I just knew that um if I just stopped doing logs (unintelligible) that would be like I quit and I knew I wasn’t going to quit um uh something uh one of my friends who was a team guy uh said to me before I came out here, we had lunch, uh he’s like no matter how much it sucks or how much it hurts just know like in the end it’s all worth it, so I kinda just kept that in mind um just kinda dealt with the pain then again I also just looked out for the other guys in the boat crew. And that helped. Yup definitely. Yea yea. Big time yea. Uh this uh a lot of guys definitely, I-I’ve been under a log or a boat with a lot of great guys um but I’ve also had really some turds. Um. Yea I’d say so. ","The gas. It was that I couldn't breathe that I couldn't run away, no but uh I don't know. I guess I didn't really have to think about it. I was just going to be there. It's not like I didn't have to think, like, OK, we're going to stay like it's. Everything else you can kinda just do but that's like something that we've never been exposed to. It was weird to go through something in here like something that'll make grown men scream in pain. Yeah, I had no like second thoughts. Like think it's something I can do just another thing. OC-8. I mean, getting rolled for that, definitely like there is a couple times, where I was like ok, can I do this? Yeah that I was kind of a little bump. Definitely just taking the time to just put in work like hours of dirt diving. Through all these possible situations and then going into it confident. Cause it's really easy to be like I got rolled for this. This could send me home very easily. Just being confident when, you know there's no reason to be confident.",… I would say First Phase daily grind. It’s not one evolution that gets people but uh … First Phase it’s just five days a week you’re getting destroyed and uh guys think too far ahead. Like I said it’s not one evolution that gets somebody its thinking too far ahead you know they’re not taking it one step at a time. I had my own motivation that I knew I needed to make it through BUD/S. Um I took a step back to look at the bigger picture uh there were guys who had been rolled who had been to Hell Week and had been sent back to BO and I’m here already in Third Phase so it kind of makes you appreciate you know what’s… it’s just seven weeks of your life. It’s not that long it’s not a big deal. What motivated me to get through was its not that big of a deal. You know its stupid things but it’s not that big of a deal. A Third Phase roll it’s not that bad. There are much worse things if you get rolled all the way back. … um … spiritual I would say so. That’s part of the reason why I’m here and why I didn’t get hurt you know that’s … sometimes people say that BUD/S is just about getting lucky and not getting hurt. I wouldn’t say it’s luck I would say … I wouldn’t say I was more protected than others but I think I had someone watching over me. There were some things that I could have very easily gotten hurt on but somehow someway I didn’t. Physical … yeah I think we all workout I think we’re all in pretty good shape because you know just to get into First Phase we’re far surpassing numbers for O-Course and for runs. You know for me it was uh the second I think the times were getting tough I think I missed that evolution uh knowing that it’s not going to last that long I know everything is regulated … I know they’re not going to do something stupid to where … as it went on it became more relaxed and I think that changed our perspective on the weeks. Two and a half hard weeks of first phase and then things start to taper off and then you go through Hell Week. Then after that things get a lot smoother so it was just putting it in perspective that I can make it through the 2.5 weeks … so it was just segmenting. Especially in Hell Week I really segmented the days.,"Uh just the every day you got to wake up and you know its not going to be fun but you got to get through it but everyone else has got to do it too. You find guys who you work with who are you know your same height and in the same boat crew with them and they’re guys who want to be here too and you just push each other and just joke around when you can and it just makes the day go by a little bit faster. No I would say that I was kind of like the younger brother who is easy to talk to, you know the older guys can be a little scary to talk to but I’m just easy to talk to and you know I have a lot to learn too so they just come and coach and teach too.Um didn’t do anything physically besides just trying to eat more calories just try to think about what I didn’t do good at what I need to do better. Um sometimes I would pray a little bit here and there, but not on a regular basis.","Oo... I would say just the grind. It didn’t really matter what Phase you were in either. So like First Phase obviously you’re getting beaten down just with the physical and metnal aspect of it but then even when that day is done you know that day will end you have to go back and clean all your gear for the next day and wake up super early and you know that even though you are sore and tired you have to willingly wake up and face these instructors that you know will destroy you again. So I think it’s just that constant wake up, get destroyed, go to sleep, sore, tired, wake up, and then it’s the same thing in Second Phase with disciplinary actions so you’re still getting wet and sandy so even though you made it past all that stuff in First Phase you think it would start to get easier but it doesn’t. And now you’re diving so you still have all that stuff but now you’re exhausted from diving. And then the island obviously you’re out working every single day and even the weekends you’re still waking up super early. So I guess its just the mental grind. Uh practice maybe I guess it depends on growing up or how you grew up so maybe people who weren’t exposed to sports or weren’t exposed to that grinding aspect … I don’t know. I mean I just worked my ass off every single day … and I mean I didn’t have someone there so no one made me do it so I guess just the willing to do it myself and I guess just like the I can do it myself. You know with sports the coaches make you do it but it’s that off time I think that’s where you make your money. I think everyone is pretty much on the same page I mean you definitely have your outcasts but I don’t think those people are here anymore and I couldn’t tell you why they’re outcasts but pretty much everyone here is similar I mean we’re all meatheads in the gym and we’re all pretty stubborn when it comes to being told you’re not doing something so at first I was a little nervous about that thinking there may be too many cooks in the kitchen but I think it was the complete opposite you know because I think everyone is so willing to help everyone out because we’re all so similar minded and we all have the same goals and it’s not like I want to be here and have to compete against you it’s more like we’re all here so let’s help each other out and make each other better and see how great we can become as a team? Um… like religious factors? I would say my number one go to whenever it got tough was dad. That was number one every single time, no doubt that was on my mind.","Probably the water. Probably water just because, like, that's one thing- I like definitely swam and stuff growing up. But I didn't swim competitively. I was never like... Like I just swam for fun... and not necessarily swimming portion, but especially like underwater stuff. It's just like- I didn't have much experience with. So it was like kind of weird at first. I guess just my nerves. Not really scary, but like, I'm just nervous. I don't know. Really just stand in the moment and just kind of attacking it and, just kinda- once it, once I start anything that I'm really like. ""Stressful situation."" I just have a way of kind of like going into like a focused mode where I was just like me doing what I need to do. And it's not- I don't like outsiders stressors kind of get in. Yeah. Absolutely. Absolutely. Like everything you do here is like everybody's gone through it with me. You guys like you're never like alone do anything here.","Um I think the uh I think running um just cause like like uh like before I came here like I wasn’t like nearly as well trained as most the other guys that come here, like the dudes that come here are absolute animals and I was not that um so I think like running because physically like I was not good at it, definitely one of the worst runners and then mentally um everyday like when you had a 4 mile it was like like I selling my soul for that 4 mile like it was like at a huge put out and the whole rest of that day would just be like me recovering from doing that 4 mile so I think like the hardest part of BUDS was like the like slick 4 mile runs was the worst part","Yeah, I think for me it uh would have been second phase, OC-8 test. Because I went… uh to my third attempt on that. So that was probably the hardest part of BUD/S. Um...and then… I think it was just I hadn't had the procedures down uh flat and so my first test was kind of rough. The second test went a lot better. Still failed that one. So then the third test, I finally got it. But um...yeah, more procedural based on that one. Um...on the island, just working all day, every day. That was a grind.","Yeah, Hell Week’s just, just a grind. There’s nothing that stands out as like this one thing was impossible. But you just have your, your moments that are just like you just kinda get through em.  It was just, just like a men, a mentality to just keep going knowing that everything is going to end eventually. Uhm, definitely seeing like just going through whatever we’re doing just take care of that one step at a time. ","I don’t know I’d say the hardest part was just getting back but uh I’d say during like physical or just overall? I’d say just the grind but uh. Yeah but it’s not really that it really wasn’t that bad I’d say, not a contributing factor but it never made me consider not continuing, I’d say the hardest part was just getting back. Umm I guess before I even start with getting back, I guess there wasn’t even an option of quitting, so like probably the only way I was getting out was my performance or like injuries, just had that expectation that it’s going to get worse or something worse is going to happen so it’s not that bad. Um I would say just having a light attitude and just not really caring too much about like nothing too far ahead and just living in the present, really just staying relaxed, I think just during the training or even ater, staying relaxed and enjoying the training when I’m off. Oh yeah exactly, the small things just to enjoy it. ","I mean technically for me it was shooting. That was the first time where I really struggled with any evolution, and not getting feedback from instructors and not really clicking at first that was the most frustrating. I guess, for me, I got cellulitis in both of my legs after Hell Week, and there was a good week or so I thought I was going to medically drop from the class. And that was probably the most stressful time I knew it was out of my control. I didn't want to, I had just been through Hell Week with these guys, and I was afraid I was just gonna go on alone. Everyone was always encouraging me even when I had to sit out through the rehab sessions. The small steps I make in improvement people would make a big deal out of them and would encourage me. Especially like my boat crew, the guys who were with me. For BUD/S, I'd always try to give half an hour every night. Where even if it meant giving up sleep. I'd just kind of sit down or lie down or whatever and just not do anything. Kind of think about the day. Yeah, I'd say almost every night, I'd try to fit in time for that. ","Working with the pistol. I can't see very well out of my right eye. It was hard to move fast and you can't really fake a pistol shoot. And I guess I can, I mean, I'm here. I knew how to pass the test, and I did what I neede to do. I read a couple of pages of a book before I go to sleep every night. Like before I go to sleep every night, I think helps like reset you and reminds you what happens in BUD/S and in life doesn't suck. I read mostly girly love stories or athletic achievement books like perform in the mile and stuff. ","I started in 36. I have had some medical issues in my back, and that caught up to me as I got rolled before Hell Week in week three. So the toughest time was I was never going to make a decision on my own to stop. I just didn't do a good job of managing my back issue the first time. I have to stretch a lot. So my performance dropped off a lot. And it was another one of those experiences I had getting cut from the big boy football team. That happened and I was like, out of the class getting rolled, and I was just like, I didn't see this coming, it wasn't part of the plan. So I was just like lost. So that was definitely the toughest part, again I just put one foot in front of the other. Start to collect myself. Medical didn't tell me very good stuff and whatnot. I guess I'm here now. And it really was just like, one foot in front of the other. I'm not going to make the decision. I think the class did like me a lot. I had the respect from the instructors as well. Seemed like at least. Which helped me at the end of the day, I thought. Because my performance completely dropped off. So I definitely felt a hundred percent welcome by my class from a lot of these guys out here. And that, that whole family is reminding me. Hey, I'm not going to make this decision. So physically, at least second time through, I just stretched everyday. But mentally, it's not natural for me, but I tried to journal. I wouldn't say, I haven't done it on a regular basis, but regardless, at the end of every day usually while stretching I try to meditate a little bit. Try to reflect, look back at the day. Pray a little bit and try to set myself outside of the moment.","The instructors. The student-instructor relationship is a hard one to navigate. Because they are the gatekeepers. And in their eyes, you know nothing. You're just a pawn in the world. I have to get through them to achieve my goals. Nothing. Nothing I would do over and over again. ",,
